### ISSUE TITLE
kube2sky can not resolve kubernetes service DNS name

### ISSUE THREAD

**Issue by antoineco** [GoogleCloudPlatform/kubernetes#10265]
There seem to be a chicken and egg problem with the current *kube-dns* replication controller (v3).

As I mentioned [there](https://github.com/GoogleCloudPlatform/kubernetes/commit/2feb658ed7a6a9f9726b04ac4c890b5dee14c0a8#commitcomment-11696141) removing the `-kube_master_url` flag forces kube2sky to use the *kubeconfig* file to find the address of the master, but this file contains the DNS name of the service, which can not be resolved:

```
clusters:
- name: local
  cluster:
     server: https://kubernetes
     insecure-skip-tls-verify: true
```

As a result *kube2sky* fails with the error:

```
I0623 22:22:32.315145       1 kube2sky.go:451] Using https://kubernetes for kubernetes master
I0623 22:22:32.315168       1 kube2sky.go:452] Using kubernetes API 
E0623 22:22:32.322136       1 reflector.go:136] Failed to list *api.Endpoints: Get https://kubernetes/api/v1beta3/endpoints: dial tcp: lookup kubernetes: no such host
```

This happens in a k8s 0.19.3 cluster powered by CoreOS, on AWS.
Surprisingly, running the exact **same** replication controller with the **same** secret in a cluster started via kube-up.sh, also on AWS, works perfectly fine:

```
I0623 22:38:36.231746       1 kube2sky.go:451] Using https://10.0.0.1:443 for kubernetes master
I0623 22:38:36.231760       1 kube2sky.go:452] Using kubernetes API v1beta3
```

This behaviour feels pretty random and I can't figure out the reason why in the second scenario `https://kubernetes` is converted to `https://10.0.0.1:443`, where is the magic?

**Comment by jlowdermilk** [comment]
cc @satnam6502, @cjcullen

**Comment by satnam6502** [comment]
@thockin

**Comment by roberthbailey** [comment]
@antoineco Do you know what generates the kubeconfig file for skydns on CoreOS/AWS? On GCE, we have a special check when generating the kubeconfig files for system services to use the master IP for DNS rather than the kubernetes service name (see https://github.com/GoogleCloudPlatform/kubernetes/blob/master/cluster/saltbase/salt/kube-addons/kube-addons.sh#L149-L152). I'm guessing that the salt-based AWS setup uses this trick (or something similar) as well.

**Comment by antoineco** [comment]
Yes the kubeconfig file is also generated by kube-addons.sh on AWS, but we don't use KUBERNETES_MASTER_NAME there so _server_ is always `https://kubernetes`.

This could have explained the failure *but*, when using `kube-up.sh`, kube2dns connects to the API using ip:port in spite of the DNS name inside the kubeconfig.

I tried a nslookup from inside the kube2sky container and it can definitely not resolve this name in both setups. Makes me wonder where the IP and port come from.

**Comment by thockin** [comment]
There's a combination of things going on.  There's a bug that is causing
some builds of kube2sky to choose (silently)  on service account tokens
instead of any other auth mechanism.  That was fixed late last week.
There's also a feature that if it can't find the DNS name you ask for it
will fall back on ${KUBERNETES_SERVICE_IP} (10.0.0.1) - also silently.

Probably tomorrow we will have the CA plumbing done and I will rebuild
kube2sky.  The new kube2sky will:

a) use a kubeconfig file if provided
b) use a master-url if provided
c) fall back on service account tokens WITH CA certs and master verification

At that point we can actually just remove the special token from ALL
distros, and just rely on service accounts (which is as it should be).

Can I beg you to hang tight?

**Comment by antoineco** [comment]
You can :) Thanks for the answer

**Comment by thockin** [comment]
As of  #10150 you will not need any auth args for kube2sky - it will find the master service and CA cert all by itself.  Does this answer your question?

**Comment by antoineco** [comment]
If it reliably finds the master service in all circumstances after the feature is merged, yes. Until then I'll just reintroduce the kube_master_url in our rc to override kubeconfig.

**Comment by thockin** [comment]
It should always find the master.  Should

**Comment by devurandom** [comment]
On my bare-metal installation of CoreOS 681.2.0 and Kubernetes 0.19.3, kube2sky tries to find the master at 127.0.0.1:8080, until I add `-kube_master_url=http://192.168.10.24:8080` to `skydns-rc.yml`.

**Comment by thockin** [comment]
You need the changes that were in 0.20.0 - 0.19.3 predates the fixes to
service tokens.

**Comment by devurandom** [comment]
I updated both master and nodes to Kubernetes v0.20.1 and removed the `kube_master_url` argument to kube2sky from `skydns-rc.yml` - the problem is back.

**Comment by thockin** [comment]
Let's walk through the dependency chain

Do you have a service account (should be auto-created):

```
$ kubectl get serviceaccount default
NAME      SECRETS
default   1
```

That account should have one secret:

```
$ kubectl get secret $(kubectl get serviceaccount default -o template -t '{{(index .secrets 0).name}}')
NAME                  TYPE                                  DATA
default-token-me7z4   kubernetes.io/service-account-token   2
```

That secret should have 2 data.  One should be a token, and one a ca.crt:

```
$ echo -ne "token: "; test -n "$(kubectl get secret $(kubectl get serviceaccount default -o template -t '{{(index .secrets 0).name}}') -o template -t '{{index .data "token"}}')" && echo yes || echo no
token: yes

$ echo -ne "ca.crt: "; test -n "$(kubectl get secret $(kubectl get serviceaccount default -o template -t '{{(index .secrets 0).name}}') -o template -t '{{index .data "ca.crt"}}')" && echo yes || echo no
ca.crt: yes
```

If you have all of those, you MIGHT have hit a race that we discovered yesterday.  Specifically DNS's pod might have been created before the secret:

```
echo -ne "pod has secret: "; [[ $(kubectl get pod -l "k8s-app=kube-dns" -o template -t "{{len (index .items 0).spec.volumes}}") -ge 1 ]] && echo yes || echo no
```

If you got here and everything is right, I will be surprised.

This also came up on IRC - make sure your `--service_account_key_file=` flag is set on kube-apiserver

**Comment by WIZARD-CXY** [comment]
@thockin I get all yes from token , ca.crt and pod has secret.
But kube2sky's log is 
`
E0701 06:24:53.596237       1 helper.go:247] expected to load root ca config from /var/run/secrets/kubernetes.io/serviceaccount/ca.crt, but got err: open /var/run/secrets/kubernetes.io/serviceaccount/ca.crt: no such file or directory
I0701 06:24:53.596387       1 kube2sky.go:455] Using https://192.168.3.1:443 for kubernetes master
I0701 06:24:53.596520       1 kube2sky.go:456] Using kubernetes API v1beta3
E0701 06:24:53.602956       1 reflector.go:136] Failed to list *api.Service: Get https://192.168.3.1:443/api/v1beta3/services: x509: failed to load system roots and no roots provided
E0701 06:24:53.604986       1 reflector.go:136] Failed to list *api.Endpoints: Get https://192.168.3.1:443/api/v1beta3/endpoints: x509: failed to load system roots and no roots provided
`
k8s version is 0.20.1 running bare-metal ubuntu.
when I manually add `-kubecfg_file=kubeconfig`. I see no errors.
So I think kube2dns needs a kubeconfig file for him to get to the apiserver.Maybe I need a volume to mount the  kubeconfig file? Is my understanding right?

**Comment by thockin** [comment]
Are you SURE the pod has the right secrets on it?

This suggests otherwise:

```
E0701 06:24:53.596237 1 helper.go:247] expected to load root ca config from
/var/run/secrets/kubernetes.io/serviceaccount/ca.crt, but got err: open
/var/run/secrets/kubernetes.io/serviceaccount/ca.crt: no such file or
directory
```

Can you `kubectl exec` into your DNS pod's kube2sky container and see what
is in the  /var/run/secrets/kubernetes.io/serviceaccount/ dir?

Did you try just deleting the DNS pod?  The replication controller will
recreate it.  If you hit the race, this will fix it.

**Comment by WIZARD-CXY** [comment]
Only a file named token in it.

**Comment by devurandom** [comment]
I do have a `serviceaccount`, but no secrets.

**Comment by devurandom** [comment]
I modified my cloud-config to better mimic `local-up-cluster.sh`, and also mixed in the example CoreOS cloud-init files as well as some changes from #10344. Now I get:
```
1 reflector.go:136] Failed to list *api.Endpoints: Get https://10.1.1.1:443/api/v1beta3/endpoints: x509: failed to load system roots and no roots provided
1 reflector.go:136] Failed to list *api.Service: Get https://10.1.1.1:443/api/v1beta3/services: x509: failed to load system roots and no roots provided
```

**Comment by WIZARD-CXY** [comment]
@devurandom Aha, you have the same problem with me.I just use kube_master_url flag https://github.com/GoogleCloudPlatform/kubernetes/pull/10393

**Comment by thockin** [comment]
I think this is being worked out right now for all other platforms.  Sorry
for missing that.

@eparis  @justinsb  @roberthbailey

**Comment by eparis** [comment]
My guess?  missing --root-ca-file= for the kube-controller-manager.

**Comment by devurandom** [comment]
Are there docs on this subject?

I have already read http://docs.k8s.io/design/service_accounts.md (and a few others), but still there are lots of questions:

* Is the CA in `--root-ca-file=` authenticated by `--service-account-key-file=`?
* If so, I cannot create the `--service-account-key-file=` on the host automatically via a systemd.service unit, unless I also automatically create the `--root-ca-file=` via a systemd.service, correct?
* Is the missing `ca.crt` secret in my default serviceaccount the same as the one I would hand to the kube-controller-manager via `--root-ca-file=`?
* Will I have to distribute these files to the client I run kubectl on?
* Will the kube-controller-manager and/or the kubelets automatically create certificates for themselves signed by `--root-ca-file=`?
* If so, how do I control which host is allowed to get such a certificate, and which will not be allowed to join the cluster?
* How is the certificate for connection with a client kubectl created? Do I need to also automatically create a client certificate using a systemd.service and then fetch the file using e.g. ssh?
* If so, I assume the automatic generation of the key as laid out in the examples is not actually recommended, as it is utterly cumbersome?
* I read that on GCE you use Salt to distribute the (manually created) root certificates. Is there any convenient way to do this on a bare-metal CoreOS cluster? Writing a properly indented `write_files` directive for `cloud-config` appears unflexible and cumbersome on its own.
* Is all authentication between the Kubernetes master (kube-apiserver, kube-controller-manager, kube-scheduler) and the kubelets and kubectls handled via HTTPS and client certificates?
* What is the `token` of the serviceaccount being used for?

**Comment by satnam6502** [comment]
On of the uses of the token is to make it more convenient to issue things like `curl` commands to the API server or application endpoints (e.g. Elasticsearch and KIbana logging endpoints). See https://github.com/GoogleCloudPlatform/kubernetes/blob/master/docs/getting-started-guides/logging-elasticsearch.md

**Comment by thockin** [comment]
@antoineco did you get this sorted?

**Comment by devurandom** [comment]
I moved my list of questions to #11000, since it is only tangential to this issue.

**Comment by antoineco** [comment]
@thockin sorry I didn't find the time to try until now. The problem doesn't seem to be solved though.
Using the addon at master:

```
$ kubectl logs kube-dns-v6-bb50g kube2sky --namespace=kube-system
I0709 17:42:10.948313       1 kube2sky.go:389] Etcd server found: http://127.0.0.1:4001
I0709 17:42:11.949348       1 kube2sky.go:455] Using http://localhost:8080 for kubernetes master
I0709 17:42:11.949368       1 kube2sky.go:456] Using kubernetes API 
[...]
```

```
$ kubectl get secrets --namespace=kube-system
NAME                  TYPE                                  DATA
default-token-4a5y5   kubernetes.io/service-account-token   1
token-kube-proxy      Opaque                                1
token-kubelet         Opaque                                1
token-system-dns      Opaque                                1
```

```
$ kubectl get serviceaccounts --namespace=kube-system
NAME      SECRETS
default   1
```

**Comment by antoineco** [comment]
Deeper insight into the relevant secret:

```
$ kubectl get secrets --namespace=kube-system token-system-dns -o yaml
apiVersion: v1
data:
  kubeconfig: YXBpVmVyc2lvbjogdjEKa2luZDogQ29uZmlnCnVzZXJzOgotIG5hbWU6IHN5c3RlbTpkbnMKICB1c2VyOgogICAgdG9rZW46IGZETEthRE40dFpHUkFBRkNjcHh2a0RXbHpiNFFLdFVFCmNsdXN0ZXJzOgotIG5hbWU6IGxvY2FsCiAgY2x1c3RlcjoKICAgICBzZXJ2ZXI6IGh0dHBzOi8va3ViZXJuZXRlcy5kZWZhdWx0CiAgICAgaW5zZWN1cmUtc2tpcC10bHMtdmVyaWZ5OiB0cnVlCmNvbnRleHRzOgotIGNvbnRleHQ6CiAgICBjbHVzdGVyOiBsb2NhbAogICAgdXNlcjogc3lzdGVtOmRucwogICAgbmFtZXNwYWNlOiBrdWJlLXN5c3RlbQogIG5hbWU6IHNlcnZpY2UtYWNjb3VudC1jb250ZXh0CmN1cnJlbnQtY29udGV4dDogc2VydmljZS1hY2NvdW50LWNvbnRleHQK
kind: Secret
metadata:
  creationTimestamp: 2015-07-09T17:32:07Z
  name: token-system-dns
  namespace: kube-system
  resourceVersion: "6200"
  selfLink: /api/v1/namespaces/kube-system/secrets/token-system-dns
  uid: 6bbc24ab-2660-11e5-b385-062aa8a99f71
type: Opaque
```

Human readable `kubeconfig` (from the secret):

```
apiVersion: v1
kind: Config
users:
- name: system:dns
  user:
    token: fDLKaDN4tZGRAAFCcpxvkDWlzb4QKtUE
clusters:
- name: local
  cluster:
     server: https://kubernetes.default
     insecure-skip-tls-verify: true
contexts:
- context:
    cluster: local
    user: system:dns
    namespace: kube-system
  name: service-account-context
current-context: service-account-context
```

How could `https://kubernetes.default` possibly be resolved at that point?

**Comment by thockin** [comment]
don't use the token-system-dns any more.  

```
$ kubectl get secrets --namespace=kube-system
NAME                              TYPE                                  DATA
default-token-tbgv6               kubernetes.io/service-account-token   2
token-admin                       Opaque                                1
token-kube-proxy                  Opaque                                1
token-kubelet                     Opaque                                1
token-system-controller-manager   Opaque                                1
token-system-dns                  Opaque                                1
token-system-logging              Opaque                                1
token-system-monitoring           Opaque                                1
token-system-scheduler            Opaque                                1
```

the service-account-token is what you want

**Comment by thockin** [comment]
and that should have 2 data, and the DNS pod should have them both

**Comment by antoineco** [comment]
Indeed, my `default-token-xxx` secrets contain only 1 data, the *token*, they're missing the *ca.crt* in every namespace. I'll have to investigate why, do you have a clue maybe?

**Comment by antoineco** [comment]
Found it: I was missing the `--root-ca-file` flag in my controller-manager systemd unit. Let's give it another try...

**Comment by thockin** [comment]
Yes, yes, please close this when it works - I am confident that THIS TIME
we've got it :)

**Comment by antoineco** [comment]
Indeed sir, that's a lot of magic but it works out of the box :+1: Thank you for your support!

**Comment by thockin** [comment]
You heard it here, folks.  Someone OTHER THAN ME has observed it to Just
Work.  I hereby declare a ban on "DNS doesn't work" bugs. :)

OK, not really.  If anyone still has trouble, let us know.

**Comment by hzy001** [comment]
start the dns addon and meet the problem:
Failed to list *api.Service: Get https://10.0.0.1:443/api/v1beta3/services: x509: failed to load system roots and no roots provided

I think I am not certificated,but how could I get certificated?

**Comment by antoineco** [comment]
How did you create your cluster?

1) The easiest way to generate your certificates is to use [this script](https://github.com/GoogleCloudPlatform/kubernetes/blob/master/cluster/saltbase/salt/generate-cert/make-ca-cert.sh). Example: 

```
./make-ca-cert.sh <master_ip> IP:<master_ip>,IP:10.10.0.1,DNS:kubernetes,DNS:kubernetes.default,DNS:kubernetes.default.svc,DNS:kubernetes.default.svc.cluster.local
```

2) Make sure you start your api server and controller manager (on the master) with the following flags

```
kube-apiserver

--client-ca-file=/srv/kubernetes/ca.crt
--tls-cert-file=/srv/kubernetes/server.cert
--tls-private-key-file=/srv/kubernetes/server.key
--token-auth-file=/srv/kubernetes/known_tokens.csv
--admission_control=NamespaceLifecycle,NamespaceExists,LimitRanger,SecurityContextDeny,ServiceAccount,ResourceQuota

kube-controller-manager

--root-ca-file=/srv/kubernetes/ca.crt
--service-account-private-key-file=/srv/kubernetes/server.key
```

3) Clear your old default secrets, they all be automatically regenerated

```
$ kubectl get secrets  --all-namespaces
NAMESPACE     NAME                  TYPE                                  DATA
default       default-token-6oahq   kubernetes.io/service-account-token   2
kube-system   default-token-ur28n   kubernetes.io/service-account-token   2

$ kubectl delete secret --namespace=default default-token-6oahq
$ kubectl delete secret --namespace=kube-system  default-token-ur28n
```

**Comment by WIZARD-CXY** [comment]
good guide👍🏻

May the force be with you

**Comment by Icedroid** [comment]
@antoineco the ./make-ca-cert.sh not run successfully in centos 7 for k8s version 18.x.

**Comment by antoineco** [comment]
Any detail about the error? The script assumes that you have a Unix group called *kube-cert*, so maybe you have to run:

```
$ groupadd -r kube-cert
```

**Comment by Icedroid** [comment]
After run ./make-ca-cert.sh ,no erros, also no one file generate in /srv/kubernetes/.
I don't know how to install k8s cluster latest version in centos 7. Did you have a article for the follow?

**Comment by antoineco** [comment]
I'll kindly redirect you to my comment here: https://github.com/GoogleCloudPlatform/kubernetes/issues/11101#issuecomment-120598107

**Comment by biswars** [comment]
@antoineco , thanks for the details for creating the certs. I followed the chain and could create the certs manually but still the communication to apiserver fails. It keeps showing the followings in the apiserver log:

Aug 18 15:35:30 core-02 kube-apiserver[456]: I0818 15:35:30.203182     456 logs.go:41] http: TLS handshake error from 10.0.2.15:43631: remote error: bad certificate
Aug 18 15:35:30 core-02 kube-apiserver[456]: I0818 15:35:30.511278     456 logs.go:41] http: TLS handshake error from 10.0.2.15:43633: remote error: bad certificate
Aug 18 15:35:31 core-02 kube-apiserver[456]: I0818 15:35:31.798885     456 logs.go:41] http: TLS handshake error from 10.0.2.15:43638: remote error: bad certificate
Aug 18 15:35:32 core-02 kube-apiserver[456]: I0818 15:35:32.015740     456 logs.go:41] http: TLS handshake error from 10.0.2.15:43640: remote error: bad certificate

Have got a query here. After clearing the secrets, they are again recreated by the token controller randomly. But how would it sync with the certs created in /srv/kubernetes directory ? As the kube-apiserver and kube-controller-manager use the certs and keys in /srv/kubernetes directory only.

**Comment by antoineco** [comment]
Did you restart your master components after creating the certs? The controller manager puts the certificate set with the `--root-ca-file` flag inside the secret, so it's important to restart both the API server and controller manager after generating new certs.

You should also delete the secret (like you did) *and* the pods which use them, since they'll use the old secret until you recreate them.

**Comment by biswars** [comment]
This is resolved using the certs generated by the script on the same machine. Earlier, I had used different same script but on different machines so there was conflict throwing bad certificate error. I am trying to use multiple nodes set up and facing some issues that I am resolving. Few queries if can be clarified would be great:

- the content of ca.crt generated and token in the secret is different than that of the ca.crt and token files in /var/run/secrets/kubernetes.io/serviceaccount/ of the pods. So, how the communication is established successfully ? (Note: this is just a query. This set up works fine though)

- Is the ca.crt self-signed during the certificate creation ? If so then where does the pod get the public key of this to decrypt

- Not quite sure why controller-manager is passed with --service-account-private-key-file option passing the private key of the apiserver certificate. What does it do with this key ?

**Comment by antoineco** [comment]
Oh, you need a single CA per cluster of course. This has to do with how a PKI works, not with Kubernetes specifically. You can read more about it [here](https://pki-tutorial.readthedocs.org/en/latest/) for example.


* The pod should always have the data from the default secret, and the secret should have the CA certificate passed to your controller-manager. If not, first delete the default secrets in each namespace (kube-system), then delete the pods which use them (kube-dns-v8). They will be recreated with the new secret mounted in /var/... If the CA.crt used in the pod is different from the one used by the API server it won't work. Are you sure you're reading the certificate content and not its base64 encoded value? Then it would mean you didn't restart your master components after replacing the certificates. 

* If you used the script from the salt setup, yes, it's self signed. This script generates one CA cert-key pair then uses it to sign two certs: server.crt/key for the API server, kubecfg.crt/key for the node components (kubelet, kube-proxy). It's your task to distribute these certs/keys to your **nodes**. The **pods** however do not use certificates for authentication, only the CA cert for checking the identity of the master (once again, I recommend you to read resources about openssl and PKI management). The authentication is performed using a **token** distributed via a secret.

* `--service-account-private-key-file` is used to sign the tokens mentioned above. Use the same key as the API server. That's all I know about it unfortunately.

**Comment by mattma** [comment]
@antoineco I had a similar problem to setup SkeyDns. Your solution helps me.

I have a secure cluster with API server `https://IP:6443`. My API server and controller manager setup like you described above. 

I have confirmed that I am using service account to SkyDns. But my container (gcr.io/google_containers/skydns:2015-03-11-001) restart infinitely. The issue here is `spec.containers{skydns}			unhealthy	Liveness probe failed: nslookup: can't resolve 'kubernetes.default.svc.cluster.local'
`

Due to `Cluster Domain` cannot be resolved. Here is [a gist](https://gist.github.com/mattma/74675115c7263d8ad708) to show my SkyDns issue. 

My question is if I remove [livenessProbe block](https://gist.github.com/mattma/74675115c7263d8ad708#file-dns-rc-yaml-L45), everything is fine. Container is running fine. 

If I use ServiceAccount to connect to API-Server, Could I safely drop `livenessProbe`, `nslookup` bash command? What does it `nslookup` do here?

Am I safe to remove `healthy` checking?

**Comment by thockin** [comment]
The liveness probe is doing a DNS lookup to prove that DNS is working.  If
it is failing then DNS is probably not working...

**Comment by antoineco** [comment]
I would add that you **shouldn't** ever remove the probe. @thockin said it all, your container restarts because DNS is simply not working.

You should check the logs of your `kube2sky` container, this is where your problem lies, not in `skydns`.

Chances are that your `default` secret doesn't contain a valid token and/or CA cert, so *kube2sky* can't connect to the API, but the logs will give you the definitive answer.

**Comment by mattma** [comment]
`kube2sky` only use args `--domain: cluster.local`, as @thockin suggested, no `kubecfg_file and master` flags are used. ServiceAccount should pick up by now, 

In my `kubelet` binary, take dns args `--cluster_dns=10.100.0.10 --cluster_domain=cluster.local`. 

what is the correct URL for the ` kubernetes master`? @antoineco 
 
```
 ➜ kubectl get po                                                                                                                                                                                                                                          ↑ ✭
NAME             READY     STATUS    RESTARTS   AGE
kube-dns-0q624   3/3       Running   1          2h

 ➜ kubectl logs kube-dns-0q624 kube2sky                                                                                                                                                                                                                    ↑ ✭
I0905 21:24:57.530192       1 kube2sky.go:389] Etcd server found: http://127.0.0.1:4001
I0905 21:24:58.574022       1 kube2sky.go:455] Using https://10.100.0.1:443 for kubernetes master
I0905 21:24:58.574081       1 kube2sky.go:456] Using kubernetes API
E0905 21:24:58.578177       1 reflector.go:136] Failed to list *api.Service: Get https://10.100.0.1:443/api/v1/services: EOF
E0905 21:24:58.578309       1 reflector.go:136] Failed to list *api.Endpoints: Get https://10.100.0.1:443/api/v1/endpoints: EOF
E0905 21:24:59.594991       1 reflector.go:136] Failed to list *api.Endpoints: Get https://10.100.0.1:443/api/v1/endpoints: read tcp 10.100.0.1:443: connection reset by peer
E0905 21:24:59.595074       1 reflector.go:136] Failed to list *api.Service: Get https://10.100.0.1:443/api/v1/services: read tcp 10.100.0.1:443: connection reset by peer
E0905 21:25:00.614569       1 reflector.go:136] Failed to list *api.Service: Get https://10.100.0.1:443/api/v1/services: read tcp 10.100.0.1:443: connection reset by peer
E0905 21:25:00.614661       1 reflector.go:136] Failed to list *api.Endpoints: Get https://10.100.0.1:443/api/v1/endpoints: read tcp 10.100.0.1:443: connection reset by peer
E0905 21:25:01.616898       1 reflector.go:136] Failed to list *api.Endpoints: Get https://10.100.0.1:443/api/v1/endpoints: read tcp 10.100.0.1:443: connection reset by peer
E0905 21:25:01.616976       1 reflector.go:136] Failed to list *api.Service: Get https://10.100.0.1:443/api/v1/services: read tcp 10.100.0.1:443: connection reset by peer
E0905 21:25:02.621630       1 reflector.go:136] Failed to list *api.Service: Get https://10.100.0.1:443/api/v1/services: read tcp 10.100.0.1:443: connection reset by peer
E0905 21:25:02.621708       1 reflector.go:136] Failed to list *api.Endpoints: Get https://10.100.0.1:443/api/v1/endpoints: read tcp 10.100.0.1:443: connection reset by peer
E0905 21:25:03.677409       1 reflector.go:136] Failed to list *api.Endpoints: Get https://10.100.0.1:443/api/v1/endpoints: read tcp 10.100.0.1:443: connection reset by peer
E0905 21:25:03.677524       1 reflector.go:136] Failed to list *api.Service: Get https://10.100.0.1:443/api/v1/services: read tcp 10.100.0.1:443: connection reset by peer
E0905 21:25:04.697392       1 reflector.go:136] Failed to list *api.Service: Get https://10.100.0.1:443/api/v1/services: read tcp 10.100.0.1:443: connection reset by peer
E0905 21:25:04.697469       1 reflector.go:136] Failed to list *api.Endpoints: Get https://10.100.0.1:443/api/v1/endpoints: read tcp 10.100.0.1:443: connection reset by peer
E0905 21:25:05.700578       1 reflector.go:136] Failed to list *api.Endpoints: Get https://10.100.0.1:443/api/v1/endpoints: read tcp 10.100.0.1:443: connection reset by peer
E0905 21:25:05.700652       1 reflector.go:136] Failed to list *api.Service: Get https://10.100.0.1:443/api/v1/services: read tcp 10.100.0.1:443: connection reset by peer
E0905 21:25:06.710294       1 reflector.go:136] Failed to list *api.Service: Get https://10.100.0.1:443/api/v1/services: read tcp 10.100.0.1:443: connection reset by peer
E0905 21:25:06.710408       1 reflector.go:136] Failed to list *api.Endpoints: Get https://10.100.0.1:443/api/v1/endpoints: read tcp 10.100.0.1:443: connection reset by peer
E0905 21:25:07.721514       1 reflector.go:136] Failed to list *api.Endpoints: Get https://10.100.0.1:443/api/v1/endpoints: read tcp 10.100.0.1:443: connection reset by peer
E0905 21:25:07.721958       1 reflector.go:136] Failed to list *api.Service: Get https://10.100.0.1:443/api/v1/services: read tcp 10.100.0.1:443: connection reset by peer
E0905 21:25:08.733786       1 reflector.go:136] Failed to list *api.Service: Get https://10.100.0.1:443/api/v1/services: read tcp 10.100.0.1:443: connection reset by peer
E0905 21:25:08.733910       1 reflector.go:136] Failed to list *api.Endpoints: Get https://10.100.0.1:443/api/v1/endpoints: read tcp 10.100.0.1:443: connection reset by peer
```

**Comment by antoineco** [comment]
Look, it's trying to hit port 443 but you mentioned earlier that you were using 6443. Something is wrong with your service account token.

**Comment by mattma** [comment]
I think what you said makes perfect sense. My API server secure port is 6443. How could I debug my **serviceaccount**? Could you reference any docs? @antoineco 

```
 ➜ kubectl get serviceaccount                                                                                                                                                                                                                           1 ↵↑ ✭
NAME      SECRETS
default   1
```

```
 ➜ kubectl describe serviceaccount/default                                                                                                                                                                                                                 ↑ ✭
Name:		default
Namespace:	default
Labels:		<none>
Secrets:	{  default-token-t9x1l    }

Tokens: 	default-token-t9x1l
```

```
 ➜ kubectl describe secrets/default-token-t9x1l                                                                                                                                                                                                            ↑ ✭
Name:		default-token-t9x1l
Namespace:	default
Labels:		<none>
Annotations:	kubernetes.io/service-account.name=default,kubernetes.io/service-account.uid=a46dae08-5360-11e5-a092-08002775ba7b

Type:	kubernetes.io/service-account-token

Data
====
ca.crt:	1220 bytes
token:	eyJhbGciOiJSUzI1NiIsInR5cCI6IkpXVCJ9.eyJpc3MiOiJrdWJlcm5ldGVzL3NlcnZpY2VhY2NvdW50Iiwia3ViZXJuZXRlcy5pby9zZXJ2aWNlYWNjb3VudC9uYW1lc3BhY2UiOiJkZWZhdWx0Iiwia3ViZXJuZXRlcy5pby9zZXJ2aWNlYWNjb3VudC9zZWNyZXQubmFtZSI6ImRlZmF1bHQtdG9rZW4tdDl4MWwiLCJrdWJlcm5ldGVzLmlvL3NlcnZpY2VhY2NvdW50L3NlcnZpY2UtYWNjb3VudC5uYW1lIjoiZGVmYXVsdCIsImt1YmVybmV0ZXMuaW8vc2VydmljZWFjY291bnQvc2VydmljZS1hY2NvdW50LnVpZCI6ImE0NmRhZTA4LTUzNjAtMTFlNS1hMDkyLTA4MDAyNzc1YmE3YiIsInN1YiI6InN5c3RlbTpzZXJ2aWNlYWNjb3VudDpkZWZhdWx0OmRlZmF1bHQifQ.Zc9hEdOhULFN-brBctkGFjvU8kACLxi8M9a1eRDNlwKzZ1RVl6kYjL6X20VtW7wjGj6uEVtznvsbW_kHdMVtf7C4WAEqW7duKC9Rfjlyt-EjEBDjKzPwobfdiONLAVa1cZvFIa5fvANstY6XLqUGqhJuboozf5M3PPZuKRfEvXsEionHZIV3v0er8Qa5r28r4iPPP_2u0Gg4linNLkhk8Zhe5dRhPX3VLY8Efmcf5YDxhJTMPzSiUJJ1LMmUWr8alawEXzHqpMOrZ9yYafY26bPst3R1Wp36CYlg8zMk9rU3pSrxQYpCe5Wjg_TlfM-OArfg2FmoTYhWYmeFSsU05A
```

```
 ➜ kubectl get po                                                                                                                                                                                                                                          ↑ ✭
NAME             READY     STATUS    RESTARTS   AGE
kube-dns-65yh7   3/3       Running   6          10m

 ➜ kubectl get po/kube-dns-65yh7 -o yaml
  containers:
  - command:
    - /usr/local/bin/etcd
    - -listen-client-urls
    - http://127.0.0.1:2379,http://127.0.0.1:4001
    - -advertise-client-urls
    - http://127.0.0.1:2379,http://127.0.0.1:4001
    - -initial-cluster-token
    - skydns-etcd
    image: gcr.io/google_containers/etcd:2.0.9
    imagePullPolicy: IfNotPresent
    name: etcd
    resources:
      limits:
        cpu: 100m
        memory: 50Mi
    terminationMessagePath: /dev/termination-log
    volumeMounts:
    - mountPath: /var/run/secrets/kubernetes.io/serviceaccount
      name: default-token-t9x1l
      readOnly: true
  - image: gcr.io/google_containers/kube2sky:1.11
    imagePullPolicy: IfNotPresent
    name: kube2sky
    resources:
      limits:
        cpu: 100m
        memory: 50Mi
    terminationMessagePath: /dev/termination-log
    volumeMounts:
    - mountPath: /var/run/secrets/kubernetes.io/serviceaccount
      name: default-token-t9x1l
      readOnly: true
  - args:
    - -machines=http://127.0.0.1:2379,http://127.0.0.1:4001
    - -addr=0.0.0.0:53
    - -domain=cluster.local
    - -nameservers=8.8.8.8:53,8.8.4.4:53
    image: gcr.io/google_containers/skydns:2015-03-11-001
    imagePullPolicy: IfNotPresent
    livenessProbe:
      exec:
        command:
        - /bin/sh
        - -c
        - nslookup kubernetes.default.svc.cluster.local localhost >/dev/null
      initialDelaySeconds: 30
      timeoutSeconds: 5
    name: skydns
    ports:
    - containerPort: 53
      name: dns
      protocol: UDP
    - containerPort: 53
      name: dns-tcp
      protocol: TCP
    resources:
      limits:
        cpu: 100m
        memory: 50Mi
    terminationMessagePath: /dev/termination-log
    volumeMounts:
    - mountPath: /var/run/secrets/kubernetes.io/serviceaccount
      name: default-token-t9x1l
      readOnly: true
  dnsPolicy: Default
  nodeName: 172.17.8.102
  restartPolicy: Always
  serviceAccount: default
  serviceAccountName: default
  volumes:
  - name: default-token-t9x1l
    secret:
      secretName: default-token-t9x1l
```

**Comment by mattma** [comment]
I have tried all the things I can, read several docs, still no success.

> Look, it's trying to hit port 443 but you mentioned earlier that you were using 6443. Something is wrong with your service account token.

I look at my `server.cert` which used in `api-server` binary.

```
            X509v3 Extended Key Usage: 
                TLS Web Server Authentication
            X509v3 Key Usage: 
                Digital Signature, Key Encipherment
            X509v3 Subject Alternative Name: 
                IP Address:172.17.8.100, IP Address:10.100.0.1, DNS:kubernetes, DNS:kubernetes.default, DNS:kubernetes.default.svc, DNS:kubernetes.default.svc.cluster.local, DNS:kube-master
```

I tried to set PORT on `172.17.8.100:6443`, `10.100.0.1:6443` before I use the `make-certs.sh` to generate the certificates, it cannot be done due to the error. I guess that I have to get rid of PORT here.

I think it may related to [make-certs.sh](https://github.com/mattma/coreos-distro/blob/feature/images/setup/utils/certs.sh), maybe it did not generate the right certificate so that `kube2sky` keep pinging on the wrong port?

I have spent on this issue for days. Almost gave up myself :(

**Comment by roberthbailey** [comment]
It looks like the port used for service accounts may be hard-coded as 443; see https://github.com/kubernetes/kubernetes/blob/master/pkg/master/master.go#L373

@saad-ali since he wrote https://github.com/kubernetes/kubernetes/pull/3618

**Comment by mattma** [comment]
@roberthbailey If I pass `--secure_port=443` instead of `--secure_port=6443` using `https` instead of `insecure` login, I should be able to hit the Master Node from `kube2sky` via `serviceAccount` ? I will definitely give it a try. I did not see anywhere in the K8S related docs. It would be great to add in the docs too.

**Comment by mattma** [comment]
@roberthbailey 

I tried on a brand new K8S stack with the `--secure_port=443` on **api-server**. Well, I think it is not the root cause of the `kube2sky` dns issue. Still seeing the logs on `kube2sky` container

```
E0906 19:29:29.960489       1 reflector.go:136] Failed to list *api.Service: Get https://10.100.0.1:443/api/v1/services: EOF
E0906 19:29:30.936314       1 reflector.go:136] Failed to list *api.Endpoints: Get https://10.100.0.1:443/api/v1/endpoints: EOF
E0906 19:29:30.963298       1 reflector.go:136] Failed to list *api.Service: Get https://10.100.0.1:443/api/v1/services: EOF
E0906 19:29:31.938809       1 reflector.go:136] Failed to list *api.Endpoints: Get https://10.100.0.1:443/api/v1/endpoints: read tcp 10.100.0.1:443: connection reset by peer
```

i think it must be something wrong with my `ServiceAccount`. What is the good docs that I could debug my `ServiceAccount`? I have following the `Start from scratch` k8s guide, do not know why it does not work. If I remove the `livenessProbe` check on `skydns` container inside `controller` **kube-dns**, everything works. No restarts on `kube2sky` container.

**Comment by mattma** [comment]
> Look, it's trying to hit port 443 but you mentioned earlier that you were using 6443. Something is wrong with your service account token.

Service account token, I am using the same `key` from  `/srv/kubernetes/server.key`. 

See `--tls-private-key-file` and `--service_account_key_file` reference the same `/srv/kubernetes/server.key`. Is it wrong? should I generate a new one?

```
  --client-ca-file=${CLUSTER_CA_FILE_PATH} \
  --tls-cert-file=${SERVER_CERT_PATH} \
  --tls-private-key-file=${SERVER_PRIVATE_KEY_PATH} \
  --admission_control=${ADMISSION_CONTROL} \
  --service_account_key_file=${SERVER_PRIVATE_KEY_PATH} \
  --service_account_lookup=false \
```

**Comment by antoineco** [comment]
> If I remove the livenessProbe check on skydns container inside controller kube-dns, everything works. No restarts on kube2sky container.

It doesn't restart, but it also doesn't work. If you try to query the internal DNS server you'll get a timeout.

> See --tls-private-key-file and --service_account_key_file reference the same /srv/kubernetes/server.key. Is it wrong? should I generate a new one?

This is correct. If I were you I'd start by deleting both my default secret and service account, and then the DNS pod. This will force the controller manager and kubelets to regenerate everything. If it still doesn't work then something may be wrong with your PKI.

Btw, you said you switched back to port 443 right? Are you nodes connecting to the API server over SSL? If yes are your node components connecting successfully?

**Comment by mattma** [comment]
@antoineco I have delete default  secret and service account, recreate a DNS pod, still does not work. 

Same error. `Failed to list *api.Service: Get https://10.100.0.1:443/api/v1/services: EOF`

> Btw, you said you switched back to port 443 right? Are you nodes connecting to the API server over SSL? If yes are your node components connecting successfully?

Yes, I have switch back to port 443, my nodes connects to API server via  `/var/lib/kubelet/kubeconfig` and  `/var/lib/kube-proxy/kubeconfig`

```
-- Logs begin at Sun 2015-09-06 19:10:23 UTC, end at Sun 2015-09-06 21:11:04 UTC. --
Sep 06 19:22:31 kube-node-01 systemd[1]: Starting Kubernetes Kubelet...
Sep 06 19:22:31 kube-node-01 rm[1360]: /usr/bin/rm: cannot remove '/opt/bin/kubelet': No such file or directory
Sep 06 19:22:31 kube-node-01 curl[1362]: Warning: Illegal date format for -z, --timecond (and not a file name).
Sep 06 19:22:31 kube-node-01 curl[1362]: Warning: Disabling time condition. See curl_getdate(3) for valid date syntax.
Sep 06 19:22:31 kube-node-01 curl[1362]: % Total    % Received % Xferd  Average Speed   Time    Time     Time  Current
Sep 06 19:22:31 kube-node-01 curl[1362]: Dload  Upload   Total   Spent    Left  Speed
Sep 06 19:22:35 kube-node-01 curl[1362]: [392B blob data]
Sep 06 19:22:35 kube-node-01 systemd[1]: Started Kubernetes Kubelet.
Sep 06 19:22:35 kube-node-01 kubelet[1424]: I0906 19:22:35.179961    1424 manager.go:127] cAdvisor running in container: "/system.slice"
Sep 06 19:22:35 kube-node-01 kubelet[1424]: I0906 19:22:35.181191    1424 fs.go:93] Filesystem partitions: map[/dev/sda9:{mountpoint:/ major:8 minor:9} /dev/sda3:{mountpoint:/usr major:8 minor:3} /dev/sda6:{mountpoint:/usr/share/oem major:8 minor:6}]
Sep 06 19:22:35 kube-node-01 kubelet[1424]: I0906 19:22:35.203662    1424 manager.go:158] Machine: {NumCores:1 CpuFrequency:2801816 MemoryCapacity:1045966848 MachineID:aeea5fe0284649598456b25caabe4f09 SystemUUID:ADC6734C-99CA-424F-8300-DB1A6F69E3A5 BootID
Sep 06 19:22:35 kube-node-01 kubelet[1424]: I0906 19:22:35.206950    1424 manager.go:164] Version: {KernelVersion:4.1.6-coreos-r1 ContainerOsVersion:CoreOS 794.0.0 DockerVersion:1.7.1 CadvisorVersion:0.16.0}
Sep 06 19:22:35 kube-node-01 kubelet[1424]: I0906 19:22:35.207536    1424 plugins.go:69] No cloud provider specified.
Sep 06 19:22:35 kube-node-01 kubelet[1424]: I0906 19:22:35.658466    1424 docker.go:295] Connecting to docker on unix:///var/run/docker.sock
Sep 06 19:22:35 kube-node-01 kubelet[1424]: I0906 19:22:35.658735    1424 server.go:663] Adding manifest file: /opt/kubernetes/manifests/
Sep 06 19:22:35 kube-node-01 kubelet[1424]: I0906 19:22:35.658792    1424 server.go:673] Watching apiserver
Sep 06 19:22:35 kube-node-01 kubelet[1424]: I0906 19:22:35.726888    1424 plugins.go:56] Registering credential provider: .dockercfg
Sep 06 19:22:35 kube-node-01 kubelet[1424]: I0906 19:22:35.727880    1424 server.go:635] Started kubelet
Sep 06 19:22:35 kube-node-01 kubelet[1424]: E0906 19:22:35.728013    1424 kubelet.go:682] Image garbage collection failed: unable to find data for container /
Sep 06 19:22:35 kube-node-01 kubelet[1424]: I0906 19:22:35.735752    1424 kubelet.go:702] Running in container "/kubelet"
Sep 06 19:22:35 kube-node-01 kubelet[1424]: I0906 19:22:35.735910    1424 server.go:63] Starting to listen on 0.0.0.0:10250
Sep 06 19:22:35 kube-node-01 kubelet[1424]: I0906 19:22:35.858599    1424 factory.go:226] System is using systemd
Sep 06 19:22:35 kube-node-01 kubelet[1424]: I0906 19:22:35.859234    1424 factory.go:234] Registering Docker factory
Sep 06 19:22:35 kube-node-01 kubelet[1424]: I0906 19:22:35.859679    1424 factory.go:89] Registering Raw factory
Sep 06 19:22:35 kube-node-01 kubelet[1424]: I0906 19:22:35.913302    1424 kubelet.go:821] Successfully registered node 172.17.8.101
Sep 06 19:22:35 kube-node-01 kubelet[1424]: I0906 19:22:35.948949    1424 manager.go:1000] Started watching for new ooms in manager
Sep 06 19:22:35 kube-node-01 kubelet[1424]: I0906 19:22:35.949393    1424 oomparser.go:183] oomparser using systemd
Sep 06 19:22:35 kube-node-01 kubelet[1424]: I0906 19:22:35.949966    1424 manager.go:245] Starting recovery of all containers
Sep 06 19:22:35 kube-node-01 kubelet[1424]: W0906 19:22:35.964238    1424 container.go:326] Failed to create summary reader for "/system.slice/tmp.mount": none of the resources are being tracked.
Sep 06 19:22:35 kube-node-01 kubelet[1424]: W0906 19:22:35.966790    1424 container.go:326] Failed to create summary reader for "/system.slice/ldconfig.service": none of the resources are being tracked.
Sep 06 19:22:35 kube-node-01 kubelet[1424]: W0906 19:22:35.967696    1424 container.go:326] Failed to create summary reader for "/system.slice/rpcbind.service": none of the resources are being tracked.
Sep 06 19:22:35 kube-node-01 kubelet[1424]: W0906 19:22:35.987759    1424 container.go:326] Failed to create summary reader for "/system.slice/usr.mount": none of the resources are being tracked.
Sep 06 19:22:35 kube-node-01 kubelet[1424]: W0906 19:22:35.989388    1424 container.go:326] Failed to create summary reader for "/system.slice/dev-mqueue.mount": none of the resources are being tracked.
Sep 06 19:22:35 kube-node-01 kubelet[1424]: W0906 19:22:35.990278    1424 container.go:326] Failed to create summary reader for "/system.slice/kmod-static-nodes.service": none of the resources are being tracked.
Sep 06 19:22:35 kube-node-01 kubelet[1424]: W0906 19:22:35.991996    1424 container.go:326] Failed to create summary reader for "/system.slice/audit-rules.service": none of the resources are being tracked.
Sep 06 19:22:35 kube-node-01 kubelet[1424]: W0906 19:22:35.992639    1424 container.go:326] Failed to create summary reader for "/system.slice/kube-proxy.service": none of the resources are being tracked.
Sep 06 19:22:35 kube-node-01 kubelet[1424]: W0906 19:22:35.995616    1424 container.go:326] Failed to create summary reader for "/system.slice/media.mount": none of the resources are being tracked.
Sep 06 19:22:35 kube-node-01 kubelet[1424]: W0906 19:22:35.997195    1424 container.go:326] Failed to create summary reader for "/system.slice/sshd-keygen.service": none of the resources are being tracked.
Sep 06 19:22:36 kube-node-01 kubelet[1424]: W0906 19:22:36.002214    1424 container.go:326] Failed to create summary reader for "/system.slice/systemd-update-done.service": none of the resources are being tracked.
Sep 06 19:22:36 kube-node-01 kubelet[1424]: W0906 19:22:36.003713    1424 container.go:326] Failed to create summary reader for "/system.slice/systemd-update-utmp.service": none of the resources are being tracked.
Sep 06 19:22:36 kube-node-01 kubelet[1424]: W0906 19:22:36.006518    1424 container.go:326] Failed to create summary reader for "/system.slice/update-engine.service": none of the resources are being tracked.
Sep 06 19:22:36 kube-node-01 kubelet[1424]: W0906 19:22:36.009111    1424 container.go:326] Failed to create summary reader for "/system.slice/flanneld.service": none of the resources are being tracked.
Sep 06 19:22:36 kube-node-01 kubelet[1424]: W0906 19:22:36.010526    1424 container.go:326] Failed to create summary reader for "/system.slice/systemd-sysusers.service": none of the resources are being tracked.
Sep 06 19:22:36 kube-node-01 kubelet[1424]: W0906 19:22:36.011649    1424 container.go:326] Failed to create summary reader for "/system.slice/systemd-networkd-wait-online.service": none of the resources are being tracked.
Sep 06 19:22:36 kube-node-01 kubelet[1424]: W0906 19:22:36.013215    1424 container.go:326] Failed to create summary reader for "/system.slice/var-lib-docker-devicemapper.mount": none of the resources are being tracked.
Sep 06 19:22:36 kube-node-01 kubelet[1424]: W0906 19:22:36.014151    1424 container.go:326] Failed to create summary reader for "/system.slice/fleet.service": none of the resources are being tracked.
Sep 06 19:22:36 kube-node-01 kubelet[1424]: W0906 19:22:36.015501    1424 container.go:326] Failed to create summary reader for "/system.slice/kube-kubelet.service": none of the resources are being tracked.
Sep 06 19:22:36 kube-node-01 kubelet[1424]: W0906 19:22:36.015935    1424 container.go:326] Failed to create summary reader for "/system.slice/system-system\\x2dcloudinit.slice": none of the resources are being tracked.
Sep 06 19:22:36 kube-node-01 kubelet[1424]: W0906 19:22:36.017455    1424 container.go:326] Failed to create summary reader for "/system.slice/systemd-hwdb-update.service": none of the resources are being tracked.
Sep 06 19:22:36 kube-node-01 kubelet[1424]: W0906 19:22:36.021376    1424 container.go:326] Failed to create summary reader for "/system.slice/dev-hugepages.mount": none of the resources are being tracked.
Sep 06 19:22:36 kube-node-01 kubelet[1424]: W0906 19:22:36.022503    1424 container.go:326] Failed to create summary reader for "/system.slice/system-addon\\x2dconfig.slice": none of the resources are being tracked.
Sep 06 19:22:36 kube-node-01 kubelet[1424]: W0906 19:22:36.022829    1424 container.go:326] Failed to create summary reader for "/system.slice/systemd-journal-flush.service": none of the resources are being tracked.
Sep 06 19:22:36 kube-node-01 kubelet[1424]: W0906 19:22:36.023567    1424 container.go:326] Failed to create summary reader for "/system.slice/systemd-tmpfiles-setup-dev.service": none of the resources are being tracked.
Sep 06 19:22:36 kube-node-01 kubelet[1424]: W0906 19:22:36.024124    1424 container.go:326] Failed to create summary reader for "/system.slice/docker.service": none of the resources are being tracked.
Sep 06 19:22:36 kube-node-01 kubelet[1424]: W0906 19:22:36.024654    1424 container.go:326] Failed to create summary reader for "/system.slice/systemd-fsck-root.service": none of the resources are being tracked.
Sep 06 19:22:36 kube-node-01 kubelet[1424]: W0906 19:22:36.025473    1424 container.go:326] Failed to create summary reader for "/system.slice/system-sshd.slice": none of the resources are being tracked.
```

```
ep 06 21:15:16 kube-node-01 curl[15574]: % Total    % Received % Xferd  Average Speed   Time    Time     Time  Current
Sep 06 21:15:16 kube-node-01 curl[15574]: Dload  Upload   Total   Spent    Left  Speed
Sep 06 21:15:18 kube-node-01 curl[15574]: [313B blob data]
Sep 06 21:15:18 kube-node-01 systemd[1]: Started Kubernetes Proxy.
Sep 06 21:15:19 kube-node-01 kube-proxy[15579]: E0906 21:15:19.270590   15579 proxysocket.go:99] Dial failed: dial tcp 10.0.2.15:443: connection refused
Sep 06 21:15:19 kube-node-01 kube-proxy[15579]: E0906 21:15:19.270693   15579 proxysocket.go:99] Dial failed: dial tcp 10.0.2.15:443: connection refused
Sep 06 21:15:19 kube-node-01 kube-proxy[15579]: E0906 21:15:19.270740   15579 proxysocket.go:99] Dial failed: dial tcp 10.0.2.15:443: connection refused
Sep 06 21:15:19 kube-node-01 kube-proxy[15579]: E0906 21:15:19.270781   15579 proxysocket.go:99] Dial failed: dial tcp 10.0.2.15:443: connection refused
Sep 06 21:15:19 kube-node-01 kube-proxy[15579]: E0906 21:15:19.270790   15579 proxysocket.go:133] Failed to connect to balancer: failed to connect to an endpoint.
```

Look at the `proxy` cannot talk to API-server neither. Is this the permission issue?

```
core@kube-node-01 ~ $ ls -lash /var/lib/kube-proxy/kubeconfig
8.0K -rw-rw---- 1 root root 2.0K Sep  6 19:10 /var/lib/kube-proxy/kubeconfig

ore@kube-node-01 ~ $ cat  /var/lib/kube-proxy/kubeconfig
cat: /var/lib/kube-proxy/kubeconfig: Permission denied

core@kube-node-01 ~ $ sudo cat /var/lib/kube-proxy/kubeconfig
apiVersion: v1
clusters:
- cluster:
    certificate-authority-data: LS0tLS1CRUdJTiBDRVJUSUZJQ0FURS0tLS0tCk1JSURXVENDQWtHZ0F3SUJBZ0lKQUxoa3pIUU1VNGpjTUEwR0NTcUdTSWIzRFFFQkN3VUFNQ0l4SURBZUJnTlYKQkFNTUZ6RTNNaTR4Tnk0NExqRXdNRUF4TkRReE5USTBPRGs1TUI0WERURTFNRGt3TmpBM016UTFPVm9YRFRJMQpNRGt3TXpBM016UTFPVm93SWpFZ01CNEdBMVVFQXd3WE1UY3lMakUzTGpndU1UQXdRREUwTkRFMU1qUTRPVGt3CmdnRWlNQTBHQ1NxR1NJYjNEUUVCQVFVQUE0SUJEd0F3Z2dFS0FvSUJBUURYTStiQ1RzTVRKbnZmSlJ4emJUL00KQUo4NHBaMWkzRmZvWjVUb0VPOUxZbmtTWHpZMkFGY1ZuZnk3KzlWZDFrc08rYWs4OWtaOGUwSjFvaHdBVWRUWQpBTWRqUUE4S3dFam00eERLWEZITlNJWjhRSjZjNDRCN0JMcmFVUlZRV2RjeDl5OE5xNnZWek14VDZZd0hiaWlMCnh0d0p0b2ZrZzVZUktGTkpNL0UxTFlpVDdBemtsbEtwM1J1NGpxbFlUZEtmRllkOUx6ZjNZUnRMN1ErZnk2Ui8KY1k3WWxOV2w5ZjNOK3Z5QXBONW5hZC91UTRyUDZRNHJ2MzZ6cTAyeWhHVW1CK285ZjdZcmd4QnAxcHJMSXN2YwpqRndFL3YxR0RRTEQya28relFobjZSZUVrazl1OEFqUlJDN2dGVnphUzJVcWYyY0labmJDZVh6QWZUNGt5d0wvCkFnTUJBQUdqZ1pFd2dZNHdIUVlEVlIwT0JCWUVGSGVVNUxDaG93Z2VVVCtScE43REl0QiswQTgzTUZJR0ExVWQKSXdSTE1FbUFGSGVVNUxDaG93Z2VVVCtScE43REl0QiswQTgzb1Nha0pEQWlNU0F3SGdZRFZRUUREQmN4TnpJdQpNVGN1T0M0eE1EQkFNVFEwTVRVeU5EZzVPWUlKQUxoa3pIUU1VNGpjTUF3R0ExVWRFd1FGTUFNQkFmOHdDd1lEClZSMFBCQVFEQWdFR01BMEdDU3FHU0liM0RRRUJDd1VBQTRJQkFRQWp1ME04MllWOTU2SGRaNU1BNm83cHgyZjkKZSs0YlRVbjR2eFNtMHJOQlRHb3dWbm44MVdDWkFtalFRNXlRRXl3MVA5eFVQUUkzSHdFWTlackVxU0Q0bEg4OQpZcWduQ00vL1dpWUk5Vmc0c29JZEZ5a3BjRmRiU3RxMGI2QjhURWNrZWlQUmU5NkJrUURiRDdHSnNYa2JsdFlTClVlT0h3QnFjMUxMRk9MY3M3My94Wmh4MGpMdC94VjBaSVFLcVdQNTZ3NkZPb2EyQWtmL3BkcG5STWRSV0RmMmIKRmpnYi9JUnlGMGdKQnNFSTg1dWJZcmVKQVFZZGY0Q0RJM1hPUHlCa0xkcmN6REU5ckN1U2wvVkxtdUpRTC8zaQplTXdhZFdNVVRHUjNPVnQ3VFY1Y3ZIWUtHbk5rRVZuMVRvTjBVamtpREI0NEFCazE5blZoanh2QzJKZHAKLS0tLS1FTkQgQ0VSVElGSUNBVEUtLS0tLQo=
    server: https://172.17.8.100:443
  name: kube-rocks
contexts:
- context:
    cluster: kube-rocks
    namespace: default
    user: mattma
  name: rocks
current-context: rocks
kind: Config
preferences: {}
users:
- name: mattma
  user:
    token: O5PEhSll0GJBhpeEUMSZJXPjIhr0zscH
```

**Comment by mattma** [comment]
A question:

Saw some examples on K8S, does the certs and keys requires to be in the group `root kube-cert`? Mine is in `root root`

```
8.0K -rw-rw---- 1 root kube-cert 1.2K Sep  6 21:40 ca.crt
 12K -rw-rw---- 1 root kube-cert 4.8K Sep  6 21:40 server.cert
8.0K -rw-rw---- 1 root kube-cert 1.7K Sep  6 21:40 server.key
```

**Comment by thockin** [comment]
"Connection refused" implies that something is not right in your setup
still.

Please try to tackle one problem at a a time.  If you SSH into a node and
curl https://10.0.2.15:443 with --insecure flag, what happens?  You need to
first be able to connect to the master directly, then to be able to connect
to the master through the 'kubernetes' service.  THEN you can worry about
service account.

**Comment by mattma** [comment]
@antoineco @thockin 

[My current development K8S stack is up](https://github.com/mattma/coreos-distro/tree/feature/images) and you should be able to follow a simple steps to deploy the K8S to a Vagrant-CoreOS environment via this [simple-guide](https://github.com/mattma/coreos-distro/tree/feature/images#quick-start-guide)

You should be able to see exactly what I am seeing and facing. Sorry to keep you guys working on the long weekend. I am not in hurry. :) Just stack this issue for like more than 70 hours. want to get over it soon.

**Comment by mattma** [comment]
@thockin 

Since the problem is not the `secure-port`, I switch from `443` to `6443`. I completely understand your comment above. I have made several adjustment in my K8S stack system. Now I think I am one step closer to the finish line. 

Check the [journal of my Stack here](https://gist.github.com/mattma/9d71de27d47c66a9d13e)

Q1: Since I am doing from scratch, I do not have a cloud provider, the Docs said it is ok, right? If you look at the journal from **controller-manager**, it raised error `controllermanager.go:201] Failed to start service controller: ServiceController should not be run without a cloudprovider.`

I logged on the master node

```
core@kube-master ~ $ curl --insecure https://172.17.8.100:6443
Unauthorized
core@kube-master ~ $ curl --insecure https://10.0.2.15:6443
Unauthorized
```

I logged on one of the Node machine

```
core@kube-node-01 ~ $ curl --insecure https://172.17.8.100:6443
Unauthorized
core@kube-node-01 ~ $ curl --insecure https://10.0.2.15:6443
curl: (7) Failed to connect to 10.0.2.15 port 6443: Connection refused
```

I understand there is an issue there. Do you think it is an error from Flannel overlay and Docker? I saw some error status in [docker journal](https://gist.github.com/mattma/9d71de27d47c66a9d13e)

**Comment by thockin** [comment]
I think that "error" is really not an error - it has come up before.

https://github.com/kubernetes/kubernetes/issues/12716

What is that 172 address?


From the node:

iptables-save

ping 10.0.2.15

ip route

**Comment by mattma** [comment]
@thockin 

> What is that 172 address?

It is the Master Node Public IP address. From the node, I try to curl API server on Master node secure port 6443. I tried the same on `10.0.2.15`, but I got the `connection refused` error. I think that I should get `Unauthorized ` output so it means proxy could talk to API server securely.

> ping 10.0.2.15

Then I logged in from one of the node in my cluster. 

```
core@kube-node-01 ~ $ curl --insecure https://172.17.8.100:6443
Unauthorized
(reverse-i-search)`c': sudo journalctl -u do^Cer
core@kube-node-01 ~ $ curl --insecure https://10.0.2.15:6443
curl: (7) Failed to connect to 10.0.2.15 port 6443: Connection refused
core@kube-node-01 ~ $ iptables-save
core@kube-node-01 ~ $ curl --insecure https://10.0.2.15:6443
curl: (7) Failed to connect to 10.0.2.15 port 6443: Connection refused
core@kube-node-01 ~ $ ping 10.0.2.15
PING 10.0.2.15 (10.0.2.15) 56(84) bytes of data.
64 bytes from 10.0.2.15: icmp_seq=1 ttl=64 time=0.026 ms
64 bytes from 10.0.2.15: icmp_seq=2 ttl=64 time=0.041 ms
64 bytes from 10.0.2.15: icmp_seq=3 ttl=64 time=0.054 ms
64 bytes from 10.0.2.15: icmp_seq=4 ttl=64 time=0.053 ms
64 bytes from 10.0.2.15: icmp_seq=5 ttl=64 time=0.086 ms
64 bytes from 10.0.2.15: icmp_seq=6 ttl=64 time=0.058 ms
64 bytes from 10.0.2.15: icmp_seq=7 ttl=64 time=0.054 ms
64 bytes from 10.0.2.15: icmp_seq=8 ttl=64 time=0.054 ms
64 bytes from 10.0.2.15: icmp_seq=9 ttl=64 time=0.053 ms
64 bytes from 10.0.2.15: icmp_seq=10 ttl=64 time=0.047 ms
64 bytes from 10.0.2.15: icmp_seq=11 ttl=64 time=0.054 ms
64 bytes from 10.0.2.15: icmp_seq=12 ttl=64 time=0.055 ms
^C
--- 10.0.2.15 ping statistics ---
12 packets transmitted, 12 received, 0% packet loss, time 11005ms
rtt min/avg/max/mdev = 0.026/0.052/0.086/0.016 ms
core@kube-node-01 ~ $ ping 172.17.8.100
PING 172.17.8.100 (172.17.8.100) 56(84) bytes of data.
64 bytes from 172.17.8.100: icmp_seq=1 ttl=64 time=0.605 ms
64 bytes from 172.17.8.100: icmp_seq=2 ttl=64 time=0.821 ms
64 bytes from 172.17.8.100: icmp_seq=3 ttl=64 time=0.748 ms
64 bytes from 172.17.8.100: icmp_seq=4 ttl=64 time=1.00 ms
64 bytes from 172.17.8.100: icmp_seq=5 ttl=64 time=0.924 ms
^C
--- 172.17.8.100 ping statistics ---
5 packets transmitted, 5 received, 0% packet loss, time 4006ms
rtt min/avg/max/mdev = 0.605/0.821/1.008/0.140 ms
```

It seems that I could ping both `10.xx` and `172.xx` address from my Node. And I tried on another node, without even do `iptables-save`, I could still ping in and get output back.

> "Connection refused" implies that something is not right in your setup
still.

> Please try to tackle one problem at a a time.  If you SSH into a node and
curl https://10.0.2.15:443 with --insecure flag, what happens?  You need to
first be able to connect to the master directly, then to be able to connect
to the master through the 'kubernetes' service. 

Does it mean that I have a right setup between my Node and Master?

**Comment by thockin** [comment]
> Then I logged in from one of the node in my cluster.
>
> core@kube-node-01 ~ $ curl --insecure https://172.17.8.100:6443
> Unauthorized

Good

> core@kube-node-01 ~ $ curl --insecure https://10.0.2.15:6443
> curl: (7) Failed to connect to 10.0.2.15 port 6443: Connection refused

Bad

> core@kube-node-01 ~ $ iptables-save

Sorry, you have to run this as root.

> core@kube-node-01 ~ $ ping 10.0.2.15
> PING 10.0.2.15 (10.0.2.15) 56(84) bytes of data.
> 64 bytes from 10.0.2.15: icmp_seq=1 ttl=64 time=0.026 ms
> 64 bytes from 10.0.2.15: icmp_seq=2 ttl=64 time=0.041 ms
> 64 bytes from 10.0.2.15: icmp_seq=3 ttl=64 time=0.054 ms
> 64 bytes from 10.0.2.15: icmp_seq=4 ttl=64 time=0.053 ms
> 64 bytes from 10.0.2.15: icmp_seq=5 ttl=64 time=0.086 ms
> 64 bytes from 10.0.2.15: icmp_seq=6 ttl=64 time=0.058 ms
> 64 bytes from 10.0.2.15: icmp_seq=7 ttl=64 time=0.054 ms
> 64 bytes from 10.0.2.15: icmp_seq=8 ttl=64 time=0.054 ms
> 64 bytes from 10.0.2.15: icmp_seq=9 ttl=64 time=0.053 ms
> 64 bytes from 10.0.2.15: icmp_seq=10 ttl=64 time=0.047 ms
> 64 bytes from 10.0.2.15: icmp_seq=11 ttl=64 time=0.054 ms
> 64 bytes from 10.0.2.15: icmp_seq=12 ttl=64 time=0.055 ms
> ^C
> --- 10.0.2.15 ping statistics ---
> 12 packets transmitted, 12 received, 0% packet loss, time 11005ms
> rtt min/avg/max/mdev = 0.026/0.052/0.086/0.016 ms

> It seems that I could ping both 10.xx and 172.xx address from my Node. And I tried on another node, without even do iptables-save, I could still ping in and get output back.

What flags is your master running with.  I think it's listening on the
wrong port or something.  Here's mine:

/usr/local/bin/kube-apiserver
    --address=127.0.0.1
    --etcd-servers=http://127.0.0.1:4001
    --cloud-provider=gce
    --admission-control=NamespaceLifecycle,NamespaceExists,LimitRanger,SecurityContextDeny,ServiceAccount,ResourceQuota
    --service-cluster-ip-range=10.0.0.0/16
    --client-ca-file=/srv/kubernetes/ca.crt
    --basic-auth-file=/srv/kubernetes/basic_auth.csv
    --cluster-name=kubernetes
    --tls-cert-file=/srv/kubernetes/server.cert
    --tls-private-key-file=/srv/kubernetes/server.key
    --secure-port=443
    --token-auth-file=/srv/kubernetes/known_tokens.csv
    --v=2
    --allow-privileged=False

If you SSH into your master machine and do `sudo netstat -nap | grep
-v ESTABLISHED` what do you get?  I get

```
$ sudo netstat -nap | grep api | grep -v ESTABLISHED
tcp        0      0 127.0.0.1:8080          0.0.0.0:*
LISTEN      4189/kube-apiserver
tcp6       0      0 :::443                  :::*
LISTEN      4189/kube-apiserver
```

This shows that I am listening on :8080 only for localhost and on :443
for anyone.

**Comment by mattma** [comment]
API-server is running in a container which is only a binary of `/kube-apiserver`. The setting is [here](https://gist.github.com/mattma/663518d49606798a0b73). I do get very similar setting like yours on `netstat`. Still cannot find the issue. @thockin

**Comment by thockin** [comment]
Please show me the results.

**Comment by mattma** [comment]
I have posted in a [gist here](https://gist.github.com/mattma/663518d49606798a0b73).

**Comment by thockin** [comment]
Nothing obviously wrong.

Firewalls?  NATs?  There are lots of things I would want to try and to
clarify.

If you log into the master and run `hostname | nc -l -p 6444` and in
another window log into the node and run `nc $masterip 6444` - what do you
get?

If you just curl any other port on the master (with nothing listening) what
error do you get?

At this point I am trying to trace basic connectivity.  Are you SURE
traffic is making it across?  Try `tcpdump -n -i any port 6443` on both
ends when you run that failed curl...

**Comment by mattma** [comment]
Hi @thockin, I have updated everything to **1.0.6**. The problem is still existed. 

I am using latest `coreos` alpha image, it does not have `netcat` binary built in. so that I could not test `nc` on master. 

I really do not think it is the network problem. I am almost certain it is something related with the certificate and key setup. 

On my MacOS, I could access `kubectl cluster-info` because I have `~/.kube/config` data setup. 

Based on the [doc here](http://kubernetes.io/v1.0/docs/getting-started-guides/scratch.html#preparing-credentials), I generated several `certs` and `keys`. `ca.crt       kubecfg.cert kubecfg.key  kubelet.cert kubelet.key  server.cert  server.key`. 

Copy the docs from the site, I do not really understand the one token and kubeconfig on the `node` machine.

```
  Next, make a kubeconfig file for the kubelets and kube-proxy. There are a couple of options for how many distinct files to make:

Use the same credential as the admin
This is simplest to setup.
One token and kubeconfig file for all kubelets, one for all kube-proxy, one for admin.
This mirrors what is done on GCE today
Different credentials for every kubelet, etc.
We are working on this but all the pieces are not ready yet.
You can make the files by copying the $HOME/.kube/config, by following the code in cluster/gce/configure-vm.sh or by using the following template:
```

I am using `certificate` access my master server from MacOS, I do not even use Token authentication. I simply copy what is on my local machine `~/.kube/config` to the `node` machine. Then download `kubectl ` binary, i could access the master node by `sudo kubectl --kubeconfig=/var/lib/kubelet/kubeconfig cluster-info`.

In my `kube-proxy`, it cannot talk to api server

```
Sep 19 00:11:26 kube-node-01 kube-proxy[1355]: E0919 00:11:26.246910    1355 proxysocket.go:99] Dial failed: dial tcp 10.0.2.15:6443: connection refused
Sep 19 00:11:26 kube-node-01 kube-proxy[1355]: E0919 00:11:26.246919    1355 proxysocket.go:133] Failed to connect to balancer: failed to connect to an endpoint.
```

`kube-proxy` binary executes `/opt/bin/kube-proxy    --master=https://${MASTER_IP}:${SECURE_PORT}    --kubeconfig=${KUBECONFIG_PROXY_PATH}    --logtostderr=true`

`KUBECONFIG_PROXY_PATH` is the same path which I used above `/var/lib/kubelet/kubeconfig `, which I could use to access api server by `kubectl`.  Does `kube-kubelet` and `kube-proxy` need a different type of `kubeconfig` ? 

Thanks

**Comment by thockin** [comment]
I'll put a hundred bucks on it being a network level error, not a cert
error.  try `docker run -d --net=host ubuntu netcat -l -p 6444` for the
test above

**Comment by mattma** [comment]
1. Run 1st `netcat` to listen on port 6444. No logs, waiting for new connection (I have let it run for 19 mins without doing anything. :) )

```
core@kube-master ~ $ docker run -d --net=host ubuntu netcat -l -p 6444
99d85551dab2c8e8d38875567c1617b797f304b689dd487ac4415a8162f516e4
core@kube-master ~ $ docker ps -l
CONTAINER ID        IMAGE               COMMAND               CREATED             STATUS              PORTS               NAMES
99d85551dab2        ubuntu              "netcat -l -p 6444"   19 minutes ago      Up 19 minutes                           furious_stallman
core@kube-master ~ $ docker logs 99d85551dab2
```

2. Run second `netcat` on the same master machine, master ip is `172.17.8.100`. Once the `netcat` starts, it output nothing. No logs. And both listening `netcat` and trying to connect `netcat` process killed. Both containers exited.

```
core@kube-master ~ $ docker run -d --net=host ubuntu netcat 172.17.8.100 6444
da9a9fb11d27d8595d2ab2aa1a3fbec06d24fc7af9597ce522f19d797da5e05f
core@kube-master ~ $ docker ps -l
CONTAINER ID        IMAGE               COMMAND                  CREATED             STATUS                     PORTS               NAMES
da9a9fb11d27        ubuntu              "netcat 172.17.8.100 "   6 seconds ago       Exited (0) 5 seconds ago                       jovial_jones

99d85551dab2        ubuntu                                 "netcat -l -p 6444"      20 minutes ago      Exited (0) 20 seconds ago                       furious_stallman
```

## second test based on above

> If you just curl any other port on the master (with nothing listening) what
error do you get?

Answer: `Connection refused`

```
core@kube-master ~ $ curl https://172.17.8.100:6565
curl: (7) Failed to connect to 172.17.8.100 port 6565: Connection refused
core@kube-master ~ $ curl http://172.17.8.100:6565
curl: (7) Failed to connect to 172.17.8.100 port 6565: Connection refused
```

## Tried the third. Tried access `tcpdump` within the `ubuntu` container. `core@kube-master ~ $ docker run --net=host -it ubuntu /bin/bash`

> At this point I am trying to trace basic connectivity.  Are you SURE
traffic is making it across?  Try `tcpdump -n -i any port 6443` on both
ends when you run that failed curl...

```
root@kube-master:/# tcpdump -n -i any port 6443
tcpdump: verbose output suppressed, use -v or -vv for full protocol decode
listening on any, link-type LINUX_SLL (Linux cooked), capture size 65535 bytes
05:15:18.939435 IP 172.17.8.101.50611 > 172.17.8.100.6443: Flags [P.], seq 549063989:549064170, ack 2379548397, win 1384, options [nop,nop,TS val 6296660 ecr 6338205], length 181
05:15:18.941059 IP 172.17.8.100.6443 > 172.17.8.101.50611: Flags [P.], seq 1:1075, ack 181, win 1392, options [nop,nop,TS val 6348209 ecr 6296660], length 1074
05:15:18.942742 IP 172.17.8.101.50611 > 172.17.8.100.6443: Flags [.], ack 1075, win 1384, options [nop,nop,TS val 6296662 ecr 6348209], length 0
05:15:18.944072 IP 172.17.8.101.50611 > 172.17.8.100.6443: Flags [P.], seq 181:1326, ack 1075, win 1384, options [nop,nop,TS val 6296663 ecr 6348209], length 1145
05:15:18.946176 IP 172.17.8.100.6443 > 172.17.8.101.50611: Flags [P.], seq 1075:2156, ack 1326, win 1392, options [nop,nop,TS val 6348215 ecr 6296663], length 1081
05:15:18.946760 IP 172.17.8.100.6443 > 172.17.8.101.50610: Flags [P.], seq 2716256910:2716257912, ack 4176630928, win 1392, options [nop,nop,TS val 6348216 ecr 6286657], length 1002
05:15:18.947753 IP 172.17.8.101.50610 > 172.17.8.100.6443: Flags [.], ack 1002, win 1384, options [nop,nop,TS val 6296667 ecr 6348216], length 0
05:15:18.987054 IP 172.17.8.101.50611 > 172.17.8.100.6443: Flags [.], ack 2156, win 1384, options [nop,nop,TS val 6296707 ecr 6348215], length 0
05:15:20.375591 IP 172.17.8.102.53410 > 172.17.8.100.6443: Flags [P.], seq 1077447070:1077447251, ack 601078591, win 1384, options [nop,nop,TS val 6273245 ecr 6339642], length 181
05:15:20.376881 IP 172.17.8.100.6443 > 172.17.8.102.53410: Flags [P.], seq 1:1075, ack 181, win 1392, options [nop,nop,TS val 6349646 ecr 6273245], length 1074
05:15:20.378229 IP 172.17.8.102.53410 > 172.17.8.100.6443: Flags [.], ack 1075, win 1384, options [nop,nop,TS val 6273247 ecr 6349646], length 0
05:15:20.378816 IP 172.17.8.102.53410 > 172.17.8.100.6443: Flags [P.], seq 181:1326, ack 1075, win 1384, options [nop,nop,TS val 6273249 ecr 6349646], length 1145
05:15:20.392196 IP 172.17.8.100.6443 > 172.17.8.102.53410: Flags [P.], seq 1075:2156, ack 1326, win 1392, options [nop,nop,TS val 6349661 ecr 6273249], length 1081
05:15:20.393344 IP 172.17.8.100.6443 > 172.17.8.102.53411: Flags [P.], seq 884812649:884813651, ack 3359851700, win 1392, options [nop,nop,TS val 6349663 ecr 6263245], length 1002
05:15:20.394108 IP 172.17.8.102.53411 > 172.17.8.100.6443: Flags [.], ack 1002, win 1384, options [nop,nop,TS val 6273264 ecr 6349663], length 0
05:15:20.432276 IP 172.17.8.102.53410 > 172.17.8.100.6443: Flags [.], ack 2156, win 1384, options [nop,nop,TS val 6273303 ecr 6349661], length 0
^C
16 packets captured
18 packets received by filter
0 packets dropped by kernel
```

Well, with those debug info, I have no idea how to fix my current issue. Sorry, forgive me. I am an UI dev, a JavaScript engineer. :) I love system stuff too. Could you help me figure out where to fix it? Or more logs you need from my system?

Along the journey of this ticket, I have learned to use `netcat`, `tcpdump`, other K8S logs reading, etc. Pretty good exercises for me. I am glad that you help me along the way. Thank you!  

I think you may be right on Network issue, Can I buy you a lunch since your bet may be right?

**Comment by devurandom** [comment]
@mattma: Try running "toolbox". That's CoreOS' command to start a container containing a Fedora with all the tools you need.

**Comment by mattma** [comment]
@devurandom thanks. Does it include HTTPs access to the K8S api server? The base line of linux should not be matter here, if I have network issue in my setup, that must be flannel overlay mapping which does not saved in IPTable, or could not be retrieved by `components` from Node machine.

**Comment by devurandom** [comment]
OT: @mattma: Use `dnf install ...` to install whatever package you want inside the `toolbox`. For checking HTTPS I recommend `gnutls-cli` ("gnutls-utils" package in Fedora). You'll figure it out by reading the manpage.

**Comment by dalanlan** [comment]
This could be a stupid question, yet i was wondering why we use `https://kubernetes` instead of `http://kubernetes` here? Since `service` is said to be a layer3 stuff (according to the service doc), i can barely understand how `http` or `https` in involved here ;-/

**Comment by roberthbailey** [comment]
The kubernetes service connects to the apiserver. In most deployments, the apiserver is only accessible (other than on the local host) via HTTPS. If you try to connect via HTTP you will get an error. The service abstraction finds you an IP to connect to. You still must specify the port to connect to (in this case inferred as 443 due to https) and the protocol to use. You can run non-http protocols over services just as easily as http(s) protocols.

**Comment by dalanlan** [comment]
@roberthbailey  Thank you for your quick response. 
> The kubernetes service connects to the apiserver.

via kube-proxy?

**Comment by roberthbailey** [comment]
Yes. It uses DNS to convert the name `kubernetes` into the service IP and then connects to the service IP (which is captured by kube-proxy and redirected to the apiserver).

**Comment by devlina** [comment]
@thockin @antoineco I am using v11 of kube-dns RC and not able to make the dns work. Can you guys please help. Pasting few logs here as mentioned in this thread. 
`kubectl get pods --all-namespaces
NAMESPACE     NAME                        READY     STATUS    RESTARTS   AGE
default       k8s-etcd-127.0.0.1          1/1       Running   0          5d
default       k8s-master-127.0.0.1        4/4       Running   0          5d
default       k8s-proxy-127.0.0.1         1/1       Running   0          5d
kube-system   kube-dns-v11-ddkm8          3/4       Running   10         27m`

`kubectl logs kube-dns-v11-ddkm8 kube2sky --namespace=kube-system
I0426 00:43:42.894958       1 kube2sky.go:462] Etcd server found: http://127.0.0.1:4001
I0426 00:43:43.898589       1 kube2sky.go:529] Using http://127.0.0.1:8080 for kubernetes master
I0426 00:43:43.898778       1 kube2sky.go:530] Using kubernetes API v1
I0426 00:43:43.899094       1 kube2sky.go:598] Waiting for service: default/kubernetes
I0426 00:43:43.901210       1 kube2sky.go:604] Ignoring error while waiting for service default/kubernetes: yaml: mapping values are not allowed in this context. Sleeping 1s before retrying.
I0426 00:43:44.902584       1 kube2sky.go:604] Ignoring error while waiting for service default/kubernetes: yaml: mapping values are not allowed in this context. Sleeping 1s before retrying.`

`kubectl logs kube-dns-v11-ddkm8 skydns --namespace=kube-system
2016/04/26 00:15:28 skydns: falling back to default configuration, could not read from etcd: 501: All the given peers are not reachable (failed to propose on members [http://127.0.0.1:4001] twice [last error: Get http://127.0.0.1:4001/v2/keys/skydns/config?quorum=false&recursive=false&sorted=false: dial tcp 127.0.0.1:4001: connection refused]) [0]
2016/04/26 00:15:28 skydns: ready for queries on cluster.local. for tcp://0.0.0.0:53 [rcache 0]
2016/04/26 00:15:28 skydns: ready for queries on cluster.local. for udp://0.0.0.0:53 [rcache 0]
2016/04/26 00:15:43 skydns: error from backend: 501: All the given peers are not reachable (failed to propose on members [http://127.0.0.1:4001] twice [last error: Get http://127.0.0.1:4001/v2/keys/skydns/local/cluster/svc/default/kubernetes?quorum=false&recursive=true&sorted=false: dial tcp 127.0.0.1:4001: connection refused]) [0]
2016/04/26 00:15:43 skydns: error from backend: 501: All the given peers are not reachable (failed to propose on members [http://127.0.0.1:4001] twice [last error: Get http://127.0.0.1:4001/v2/keys/skydns/local/cluster/svc/default/kubernetes?quorum=false&recursive=true&sorted=false: dial tcp 127.0.0.1:4001: connection refused]) [0]`

Also seen this in kube apiserver log: `http: TLS handshake error from 172.17.0.3:39421: remote error: bad certificate`

`ps aux |grep controller
root      5612  0.4  1.0 291660 40696 ?        Ssl  Apr20  35:10 /hyperkube controller-manager --master=127.0.0.1:8080 --service-account-private-key-file=/srv/kubernetes/server.key --root-ca-file=/srv/kubernetes/ca.crt --min-resync-period=3m --v=2`

`ps aux |grep apiserver
root      5663  2.8  9.7 696292 396316 ?       Ssl  Apr20 214:46 /hyperkube apiserver --service-cluster-ip-range=10.0.0.1/24 --insecure-bind-address=127.0.0.1 --etcd-servers=http://127.0.0.1:4001 --admission-control=NamespaceLifecycle,LimitRanger,SecurityContextDeny,ServiceAccount,ResourceQuota --client-ca-file=/srv/kubernetes/ca.crt --basic-auth-file=/srv/kubernetes/basic_auth.csv --min-request-timeout=300 --tls-cert-file=/srv/kubernetes/server.cert --tls-private-key-file=/srv/kubernetes/server.key --token-auth-file=/srv/kubernetes/known_tokens.csv --allow-privileged=true --v=4`

I am using v11 rc https://github.com/kubernetes/kubernetes/blob/release-1.2/cluster/addons/dns/skydns-rc.yaml.in with  --kube-master-url=http://127.0.0.1:8080 set for kube2sky container.

Can share more results if required.

**Comment by BruceZu** [comment]
I meet the same issue 
[root@k8s-09 ~]# kubectl logs   kube-dns-4006485561-i21lk  -c kube-dns  --namespace=kube-system | more
```
I1207 03:22:16.184678       1 dns.go:167] Waiting for service: default/kubernetes
I1207 03:22:16.184923       1 logs.go:41] skydns: ready for queries on cluster.local. for tcp://0.0.0.0:10053 [rcache 0]
I1207 03:22:16.184966       1 logs.go:41] skydns: ready for queries on cluster.local. for udp://0.0.0.0:10053 [rcache 0]
I1207 03:22:16.281336       1 dns.go:173] Ignoring error while waiting for service default/kubernetes: Get http://127.0.0.1:8080/api/v1/namespaces/defau
lt/services/kubernetes: dial tcp 127.0.0.1:8080: getsockopt: connection refused. Sleeping 1s before retrying.
E1207 03:22:16.281941       1 reflector.go:214] pkg/dns/dns.go:155: Failed to list *api.Endpoints: Get http://127.0.0.1:8080/api/v1/endpoints?resourceVe
rsion=0: dial tcp 127.0.0.1:8080: getsockopt: connection refused
E1207 03:22:16.282276       1 reflector.go:214] pkg/dns/dns.go:156: Failed to list *api.Service: Get http://127.0.0.1:8080/api/v1/services?resourceVersi
on=0: dial tcp 127.0.0.1:8080: getsockopt: connection refused
I1207 03:22:17.281981       1 dns.go:173] Ignoring error while waiting for service default/kubernetes: Get http://127.0.0.1:8080/api/v1/namespaces/defau
lt/services/kubernetes: dial tcp 127.0.0.1:8080: getsockopt: connection refused. Sleeping 1s before retrying.
```
while this works:
[root@k8s-09 ~]# curl  http://127.0.0.1:8080/api/v1/namespaces/default/services/kubernetes
```
{
  "kind": "Service",
  "apiVersion": "v1",
  "metadata": {
    "name": "kubernetes",
    "namespace": "default",
    "selfLink": "/api/v1/namespaces/default/services/kubernetes",
    "uid": "bbb6cd1a-a83f-11e6-9595-ecf4bbc78ce4",
    "resourceVersion": "7",
    "creationTimestamp": "2016-11-11T18:50:36Z",
    "labels": {
      "component": "apiserver",
      "provider": "kubernetes"
    }
  },
  "spec": {
    "ports": [
      {
        "name": "https",
        "protocol": "TCP",
        "port": 443,
        "targetPort": 443
      }
    ],
    "clusterIP": "10.96.0.1",
    "type": "ClusterIP",
    "sessionAffinity": "ClientIP"
  },
  "status": {
    "loadBalancer": {}
  }
}
```[root@k8s-09 ~]#
